{
    "$schema": "http://json-schema.org/draft-06/schema#",
    "description": "",
    "type": "object",
    "properties": {
        "id": {
            "type": "string",
            "minLength": 1
        },
        "title": {
            "type": "string",
            "minLength": 1
        },
        "description": {
            "type": "string",
            "minLength": 1
        },
        "references": {
            "type": "array",
            "items": {
                "required": [
                    "contract_address"
                ],
                "properties": {}
            }
        },
        "credits": {
            "type": "string",
            "minLength": 1
        },
        "vulnerability_type": {
            "type": "object",
            "properties": {
                "cwe": {
                    "type": "string",
                    "minLength": 1
                },
                "swc": {
                    "type": "string",
                    "minLength": 1
                }
            },
            "required": [
                "cwe",
                "swc"
            ]
        },
        "severity": {
            "type": "number"
        },
        "affected": {
            "type": "object",
            "properties": {
                "contractName": {
                    "type": "string",
                    "minLength": 1
                },
                "address": {
                    "type": "string",
                    "minLength": 1
                }
            },
            "required": [
                "contractName",
                "address"
            ]
        },
        "signature": {
            "type": "string",
            "minLength": 1
        }
    },
    "required": [
        "id",
        "title",
        "description",
        "references",
        "credits",
        "vulnerability_type",
        "severity",
        "affected",
        "signature"
    ]
}