{
    "id": "CVE-2018-13227",
    "title": "Integer Overflow or Wraparound",
    "description": "The sell function of a smart contract implementation for MoneyChainNet (MCN), an Ethereum token, has an integer overflow in which \"amount * sellPrice\" can be zero, consequently reducing a seller's assets.\n",
    "references": [
        "https://github.com/BlockChainsSecurity/EtherTokens/blob/master/ETHEREUMBLACK/sell%20integer%20overflow.md",
        "https://github.com/BlockChainsSecurity/EtherTokens/tree/master/MoneyChainNetToken"
    ],
    "credits": "BlockChainsSecurity",
    "vulnerability_type": {
        "cwe": "CWE-190",
        "swc": "SWC-101"
    },
    "severity": 7.5,
    "affected": {
        "contractName": "MoneyChainNetToken",
        "address": "0x77727EF417696F95A10652cF2d02d6421DDA5048"
    },
    "signature": "649feaad833f4ca3539d83beedcabc3f"
}
