{
    "id": "CVE-2018-13613",
    "title": "Integer Overflow or Wraparound",
    "description": "The mintToken function of a smart contract implementation for CON0217, an Ethereum token, has an integer overflow that allows the owner of the contract to set the balance of an arbitrary user to any value.\n",
    "references": [
        "https://github.com/BlockChainsSecurity/EtherTokens/blob/master/GEMCHAIN/mint%20integer%20overflow.md",
        "https://github.com/BlockChainsSecurity/EtherTokens/tree/master/CON0217"
    ],
    "credits": "BlockChainsSecurity",
    "vulnerability_type": {
        "cwe": "CWE-190",
        "swc": "SWC-101"
    },
    "severity": 7.5,
    "affected": {
        "contractName": "CON0217",
        "address": "0xadaa8c29ab35c5bf74af37aa799904c7b283f11d"
    },
    "signature": "824466b0825253d415f371dfca752775"
}
