{
    "id": "CVE-2018-11561",
    "title": "Integer Overflow or Wraparound",
    "description": "An integer overflow in the unprotected distributeToken function of a smart contract implementation for EETHER (EETHER), an Ethereum ERC20 token, will lead to an unauthorized increase of an attacker's digital assets.\n",
    "references": [
        "https://github.com/rootclay/Audit-of-smart-contracts/blob/master/0x00a0cbe98e4d110b0fa82646152d77babf2951d0/README.md"
    ],
    "credits": "rootclay",
    "vulnerability_type": {
        "cwe": "CWE-190",
        "swc": "SWC-101"
    },
    "severity": 7.5,
    "affected": {
        "contractName": "ERC20Token",
        "address": "0x00a0cbe98e4d110b0fa82646152d77babf2951d0"
    },
    "signature": "f62a4eab795ea6edc83a98d4777a4f38"
}
