{
    "id": "CVE-2018-13199",
    "title": "Integer Overflow or Wraparound",
    "description": "The sell function of a smart contract implementation for ETHEREUMBLACK (ETCBK), an Ethereum token, has an integer overflow in which \"amount * sellPrice\" can be zero, consequently reducing a seller's assets.\n",
    "references": [
        "https://github.com/BlockChainsSecurity/EtherTokens/blob/master/ETHEREUMBLACK/sell%20integer%20overflow.md"
    ],
    "credits": "BlockChainsSecurity",
    "vulnerability_type": {
        "cwe": "CWE-190",
        "swc": "SWC-101"
    },
    "severity": 7.5,
    "affected": {
        "contractName": "ETHEREUMBLACK",
        "address": "0xE2fA3d7B292c216390AbAd4c625d5f2524B85A1f"
    },
    "signature": "649feaad833f4ca3539d83beedcabc3f"
}
