{
    "id": "CVE-2018-13131",
    "title": "Integer Overflow or Wraparound",
    "description": "SpadePreSale is a smart contract running on Ethereum. The mint function has an integer overflow that allows minted tokens to be arbitrarily retrieved by the contract owner.\n",
    "references": [
        "https://github.com/dwfault/AirTokens/blob/master/SPXToken/mint%20interger%20overflow.md",
        "https://github.com/dwfault/AirTokens/tree/master/SpadePreSale"
    ],
    "credits": "dwfault",
    "vulnerability_type": {
        "cwe": "CWE-190",
        "swc": "SWC-101"
    },
    "severity": 7.5,
    "affected": {
        "contractName": "SpadePreSale",
        "address": "0x50ca2de80e803bf4b00f188545bca959540c5582"
    },
    "signature": "37a6cd24ed0a87333f847c750462552e"
}
