{
    "id": "CVE-2018-13207",
    "title": "Integer Overflow or Wraparound",
    "description": "The sell function of a smart contract implementation for PornCoin (PRNC), an Ethereum token, has an integer overflow in which \"amount * sellPrice\" can be zero, consequently reducing a seller's assets.\n",
    "references": [
        "https://github.com/BlockChainsSecurity/EtherTokens/blob/master/ETHEREUMBLACK/sell%20integer%20overflow.md",
        "https://github.com/BlockChainsSecurity/EtherTokens/tree/master/PornCoin"
    ],
    "credits": "BlockChainsSecurity",
    "vulnerability_type": {
        "cwe": "CWE-190",
        "swc": "SWC-101"
    },
    "severity": 7.5,
    "affected": {
        "contractName": "PornCoin",
        "address": "0xc310755f88145cabcaa06c714cd668b5465dceaa"
    },
    "signature": "649feaad833f4ca3539d83beedcabc3f"
}
