{
    "id": "CVE-2018-13198",
    "title": "Integer Overflow or Wraparound",
    "description": "The sell function of a smart contract implementation for STeX Exchange ICO (STE), an Ethereum token, has an integer overflow in which \"amount * sellPrice\" can be zero, consequently reducing a seller's assets.\n",
    "references": [
        "https://github.com/BlockChainsSecurity/EtherTokens/blob/master/ETHEREUMBLACK/sell%20integer%20overflow.md",
        "https://github.com/BlockChainsSecurity/EtherTokens/tree/master/STE"
    ],
    "credits": "BlockChainsSecurity",
    "vulnerability_type": {
        "cwe": "CWE-190",
        "swc": "SWC-101"
    },
    "severity": 7.5,
    "affected": {
        "contractName": "STE",
        "address": "0xeba49ddea9f59f0a80ecbb1fb7a585ce0bfe5a5e"
    },
    "signature": "2ea98a1b817cc68a824fdb27640c0464"
}
