{
    "id": "CVE-2018-13510",
    "title": "Integer Overflow or Wraparound",
    "description": "The mintToken function of a smart contract implementation for Welfare Token Fund (WTF), an Ethereum token, has an integer overflow that allows the owner of the contract to set the balance of an arbitrary user to any value.\n",
    "references": [
        "https://github.com/BlockChainsSecurity/EtherTokens/blob/master/GEMCHAIN/mint%20integer%20overflow.md",
        "https://github.com/BlockChainsSecurity/EtherTokens/tree/master/WelfareTokenFund"
    ],
    "credits": "BlockChainsSecurity",
    "vulnerability_type": {
        "cwe": "CWE-190",
        "swc": "SWC-101"
    },
    "severity": 7.5,
    "affected": {
        "contractName": "WelfareTokenFund",
        "address": "0x83b6aD8E37Ab7A4F71da533A35271484270EC6c2"
    },
    "signature": "f2dea3f6ecb1397e9005efbd42dc90aa"
}
