{
    "id": "CVE-2018-14088",
    "title": "Integer Overflow or Wraparound",
    "description": "An issue was discovered in a smart contract implementation for STeX White List (STE(WL)), an Ethereum token. The contract has an integer overflow. If the owner sets the value of amount to a large number then the \"amount * 1000000000000000\" will cause an integer overflow in withdrawToFounders().\n",
    "references": ["https://github.com/hellowuzekai/blockchains/blob/master/overflow3.md"],
    "credits": "hellowuzekai",
    "vulnerability_type": {
        "cwe": "CWE-190",
        "swc": "SWC-101"
    },
    "severity": 9.8,
    "affected": {
        "contractName": "STeX_WL",
        "address": "0x1f31D1168efE4bD22D00D31FC425e5BcB54c75E7"
    },
    "signature": "d0ed0f00911a2bc181e6ea454b7457df"
}
