{
    "id": "CVE-2018-12062",
    "title": "Improper Access Control",
    "description": "The sell function of a smart contract implementation for SwftCoin (SWFTC), a tradable Ethereum ERC20 token, allows a potential trap that could be used to cause financial damage to the seller, because of overflow of the multiplication of its argument amount and a manipulable variable sellPrice, aka the \"tradeTrap\" issue.\n",
    "references": ["https://peckshield.com/2018/06/11/tradeTrap/"],
    "credits": "peckshield.com",
    "vulnerability_type": {
        "cwe": "CWE-284",
        "swc": "SWC-105"
    },
    "severity": 7.5,
    "affected": {
        "contractName": "SwftCoin",
        "address": "0x0bb217e40f8a5cb79adf04e1aab60e5abd0dfc1e"
    },
    "signature": "649feaad833f4ca3539d83beedcabc3f"
}
